{
  "record_type": "horus_principal_source_profile",
  "version": "1.0.0",
  "principal_id": "russian-federation",
  "principal_name": "Russian Federation",
  "principal_type": "body",
  "aliases": ["Russia", "Russian Federation", "Российская Федерация"],
  "original_languages": ["ru"],
  "timezone": "Europe/Moscow",
  "calendars": [{"id": "gregorian", "role": "local"}],
  "channels": [
    {"channel_id": "kremlin-ru", "name": "President of Russia", "base_url": "http://kremlin.ru/", "channel_class": "PRIMARY", "languages": ["ru"], "supported_methods": ["DIRECT_FIRST_PARTY_ARCHIVE", "DIRECT_FIRST_PARTY_SITE_SEARCH", "FIRST_PARTY_DOMAIN_RECOVERY"], "notes": "First-party presidential and state record."},
    {"channel_id": "mid-ru", "name": "Ministry of Foreign Affairs of the Russian Federation", "base_url": "https://mid.ru/", "channel_class": "ALTERNATE_PRIMARY", "languages": ["ru"], "supported_methods": ["DIRECT_FIRST_PARTY_ARCHIVE", "DIRECT_FIRST_PARTY_SITE_SEARCH", "ALTERNATE_FIRST_PARTY_CHANNEL", "FIRST_PARTY_DOMAIN_RECOVERY"], "notes": "First-party foreign-policy channel."},
    {"channel_id": "mil-ru", "name": "Ministry of Defence of the Russian Federation", "base_url": "https://mil.ru/", "channel_class": "ALTERNATE_PRIMARY", "languages": ["ru"], "supported_methods": ["ALTERNATE_FIRST_PARTY_CHANNEL", "FIRST_PARTY_DOMAIN_RECOVERY"], "notes": "First-party defence channel."}
  ],
  "non_t1_classes": ["STATE_NEWS_AGENCY", "INDEPENDENT_PRESS", "FOREIGN_GOVERNMENT", "AGGREGATOR", "TRANSLATION_ONLY"],
  "completeness": "PENDING_PROBE"
}
